{
	"name": "Title",
	"fieldtype": "201327fe-3067-4316-a155-3fe2a52e05c0",
	"datatype": "VARCHAR",
	"indexes": "0",
	"null_switch": "NOT NULL",
	"store": 0,
	"on_get_model_field": "",
	"on_save_model_field": "",
	"initiator_on_get_model": "",
	"initiator_on_save_model": "",
	"xml": "<field\n\ttype=\"text\"\n\tname=\"title\"\n\tlabel=\"Title\"\n\trequired=\"true\"\n\tmaxlength=\"120\"\n\tfilter=\"STRING\"\n/>",
	"datalenght": "Other",
	"datalenght_other": "120",
	"datadefault": "",
	"datadefault_other": "",
	"add_css_view": 0,
	"css_view": "",
	"add_css_views": 0,
	"css_views": "",
	"add_javascript_view_footer": 0,
	"javascript_view_footer": "",
	"add_javascript_views_footer": 0,
	"javascript_views_footer": "",
	"guid": "40755c41-41af-4c23-92df-c8470d7ca513",
	"@dependencies": [
		{
			"key": "guid",
			"value": "201327fe-3067-4316-a155-3fe2a52e05c0",
			"entity": "fieldtype",
			"table": "#__componentbuilder_fieldtype",
			"direction": "out"
		}
	]
}
